"conversation_id_str","created_at","favorite_count","full_text","id_str","image_url","in_reply_to_screen_name","lang","location","quote_count","reply_count","retweet_count","tweet_url","user_id_str","username"
"1086476954524561409","Sat Jan 19 04:14:26 +0000 2019","23","Gw ngejelasin bagaimana gw dapet cashback ovo dari bayar indihome di tokopedia pake kupon tokopedia yg gw beli pake grabreward dari aplikasi grab ke bokap gw https://t.co/hsf8g867cp","1086476954524561409","https://pbs.twimg.com/media/DxPxBNQV4AAKpA0.jpg","","in","","0","2","12","https://x.com/dmsrmdnt/status/1086476954524561409","1163408148","dmsrmdnt"
"1087032745174261760","Sun Jan 20 17:02:57 +0000 2019","0","PROMO PEMASANGAN WIFI INDIHOME WILAYAH SURABAYA https://t.co/tm4aF67KWv","1087032745174261760","https://pbs.twimg.com/media/DxXqaxKU0AMflRk.jpg","","in","Kota Surabaya, Jawa Timur","0","0","0","https://x.com/indihome_sbynew/status/1087032745174261760","1087028929758560256","indihome_sbynew"
"1086624386004578304","Sat Jan 19 14:00:16 +0000 2019","0","Indihome &amp;Telkomsel katanya udah ngga ngeblok netflix!!","1086624386004578304","","","in","Subang, Indonesia","0","0","0","https://x.com/chasan_id/status/1086624386004578304","101165062","chasan_id"
"1086241038358896640","Fri Jan 18 12:36:59 +0000 2019","0","kzl sm indihome","1086241038358896640","","","in","","0","1","0","https://x.com/flcwrty/status/1086241038358896640","958579679010664449","flcwrty"
"1086796951524323328","Sun Jan 20 01:25:59 +0000 2019","0","Aaaaaa sinyal indihome masih jelek","1086796951524323328","","","in","","0","1","0","https://x.com/naddongii/status/1086796951524323328","131771900","naddongii"
"1086897372691492866","Sun Jan 20 08:05:01 +0000 2019","0","Min @TelkomCare tolong cek dong koneksi indihome saya mati. Jangan minta saya restart modem ya. Udah saya coba berkali².","1086897372691492866","","","in","Tangerang, Indonesia","0","1","0","https://x.com/dmzdms/status/1086897372691492866","130736560","dmzdms"
"1087014461154578432","Sun Jan 20 15:50:17 +0000 2019","0","Kacau lemotnya ini indihome asu.","1087014461154578432","","","in","","0","1","0","https://x.com/nicstr_/status/1087014461154578432","232424838","nicstr_"
"1086697067886522368","Sat Jan 19 18:49:05 +0000 2019","0","akhirnya ih indihome bisa buka netflix","1086697067886522368","","","in","","0","2","0","https://x.com/treouvaille/status/1086697067886522368","1527269167","treouvaille"
"1086498269335674880","Sat Jan 19 05:39:08 +0000 2019","1","Di buat sangat sangat mangkel sama indihome @TelkomCare","1086498269335674880","","","in","kwangya","0","1","0","https://x.com/nurullyaini/status/1086498269335674880","233031843","nurullyaini"
"1086184852636880896","Fri Jan 18 08:53:43 +0000 2019","1","Ciyeee indihome nggak blokir Netflix lagi","1086184852636880896","","","in","något pronomen!","0","0","0","https://x.com/elnigmaticc/status/1086184852636880896","991633492923506689","elnigmaticc"
"1086320620709634048","Fri Jan 18 17:53:13 +0000 2019","0","Sad indihome q masi belum bisa buka netflix","1086320620709634048","","","in","","0","2","0","https://x.com/Mahustet/status/1086320620709634048","81342202","Mahustet"
"1086255880025165826","Fri Jan 18 13:35:58 +0000 2019","0","Indihome seleraku~","1086255880025165826","","","in","Lampung samarinda","0","0","0","https://x.com/yusufahmaddd/status/1086255880025165826","1069829311","yusufahmaddd"
"1086592658091343872","Sat Jan 19 11:54:12 +0000 2019","0","indihome lagi error? gue nge ping error trs","1086592658091343872","","","in","moa's","0","2","0","https://x.com/choesoobiin/status/1086592658091343872","3726998233","choesoobiin"
"1086639095558791169","Sat Jan 19 14:58:43 +0000 2019","2","Smangat &amp; Keyakinan bisa tercapai 2x lbh yakin berkat dukungan keluarga indihome. #livingthetelkomway #livingthetelkomwaytreg2 #livingthetelkomwaybanten #smartjawarabanten https://t.co/2XCRFJotlW","1086639095558791169","https://pbs.twimg.com/tweet_video_thumb/DxSEfBdUcAEq5gp.jpg","","in","Tangerang","0","0","0","https://x.com/budiku12/status/1086639095558791169","235739938","budiku12"
"1086519179086200832","Sat Jan 19 07:02:13 +0000 2019","0","Kenapa indihome akhir-akhir ini lemot","1086519179086200832","","","in","Jakarta Selatan, DKI Jakarta","0","1","0","https://x.com/hary_ardiansyah/status/1086519179086200832","841207788","hary_ardiansyah"
"1086633104255537155","Sat Jan 19 14:34:55 +0000 2019","0","Ingin hati maraton drama tapi wifi tidak mendukung tercapainya maksud hati Terimakasih Indihome. @TelkomCare","1086633104255537155","","","in","","0","2","0","https://x.com/salsaarhmi/status/1086633104255537155","1029348520715681792","salsaarhmi"
"1086173187786919936","Fri Jan 18 08:07:22 +0000 2019","0","phychole Halo Kak apakah saat ini jaringan IndiHome Kakak masih berkendala ? Infokan kami keluhan detail no Internet dan no HP aktif via DM kami akan cek utk penanganan yg sesuai. Terima kasih -Ares","1086173187786919936","","","in","","0","0","0","https://x.com/jaeyunct/status/1086173187786919936","1169539706","jaeyunct"
"1086950348399362048","Sun Jan 20 11:35:32 +0000 2019","0","mau tanya dong saya kan dulu bayar pasang indihome paketnya perbulan harganya 420 rb nah tbtb 4 bulan kebelakang bayarnya 460 kok bisa naik trus gitu pembayarannya ? no indihome 111801000420 @TelkomCare","1086950348399362048","","","in","180825 / 190713","0","1","0","https://x.com/jihyoddes/status/1086950348399362048","1196942832","jihyoddes"
"1086173205298143232","Fri Jan 18 08:07:26 +0000 2019","0","fikeripik Halo Kak maaf atas ketidaknyamanan yg di alami. Apakah saat ini ada kendala pada layanan IndiHome Kakak ? Infokan kami detail keluhan dan no Internet serta no HP aktif via DM. Kami akan cek utk penanganan yg sesuai. Terima kasih -Ares","1086173205298143232","","","in","","0","0","0","https://x.com/jaeyunct/status/1086173205298143232","1169539706","jaeyunct"
"1086173183005335552","Fri Jan 18 08:07:21 +0000 2019","0","_carcin Halo Kak infokan kami detail kendala saat registrasi IndiHome via DM infokan titik koordinat agar lebih akurat kami akan bantu cek ketersediaan ODP terdekat utk pemasangan IndiHome. Apakah sudah dicoba registrasi via aplikasi myIndiHome Kak ? Terima kasih - Ares","1086173183005335552","","","in","","0","0","0","https://x.com/jaeyunct/status/1086173183005335552","1169539706","jaeyunct"
"1086909968995905536","Sun Jan 20 08:55:05 +0000 2019","0","Yth. Admin indihome sya mohon dibantu utk wilayah saya agar ditambah jaringan indihome nya dan beberapa warga sekitar pun ada yang ingin pasang namun sayangnya penuh.... Tks min","1086909968995905536","","","in","","0","1","0","https://x.com/josejo_se/status/1086909968995905536","701272522453446656","josejo_se"
"1087027175667032064","Sun Jan 20 16:40:49 +0000 2019","0","Tolong dong @TelkomCare di follow up pembayaran saya jatuh tempo tanggal 20 tapi dibayar dari siang sampai malem ko tidak bisa ya? Mau nya indihome ini apa? Sistem pembayaranya tolong di perbaiki ya.","1087027175667032064","","","in","","0","1","0","https://x.com/riskynopaldi/status/1087027175667032064","1070329101154627584","riskynopaldi"
"1085887703596425216","Thu Jan 17 13:12:58 +0000 2019","0","Jancook speed indihome @TelkomCare cm dpt 2mbps !!! Tanda2 mau bangkrut kah cook !!!","1085887703596425216","","","in","","0","1","0","https://x.com/r_dan_a/status/1085887703596425216","376620754","r_dan_a"
"1086615808829083655","Sat Jan 19 13:26:11 +0000 2019","1","Pantes aja gua gabisa nonton di netflix.. indihome blokir si netflix ajir... indihome nyediain aplikasi nonton sih cuma isinya India sama Korea gitu kebanyakan.. kan ga sesuai selera banget. Masak buka netflix kudu pke vpn","1086615808829083655","","","in","Indonesia","0","0","0","https://x.com/pulunghadee/status/1086615808829083655","1043904738033430532","pulunghadee"
"1086201831275950080","Fri Jan 18 10:01:11 +0000 2019","0","WOY @NetflixID UDAH BISA DIBUKA PAKE INDIHOME. MANTAP SEKALI BOI","1086201831275950080","","","in","Jakarta Capital Region","0","1","0","https://x.com/IDJongJava/status/1086201831275950080","1040249361966424064","IDJongJava"
"1086220282828705793","Fri Jan 18 11:14:31 +0000 2019","0","Hore blokiran udah dibuka sama indihome ","1086220282828705793","","","in","","0","0","0","https://x.com/ash_asher/status/1086220282828705793","164632811","ash_asher"
"1086228198625406976","Fri Jan 18 11:45:58 +0000 2019","0","Min minta tolong ditindak lanjuti siaran tv indihome tidak nyala dari kemarin tapi untuk internet bisa @TelkomCare 0317403440","1086228198625406976","","","in","Kota Surabaya, Jawa Timur","0","1","0","https://x.com/adimarsetyoo/status/1086228198625406976","2369844488","adimarsetyoo"
"1086417664577171456","Sat Jan 19 00:18:50 +0000 2019","0","ini tmpt gue yang lemot padahal pakai indihome loh knpa jaringan lemot banget anjir mau streaming nyendat2 gtu ksl","1086417664577171456","","","in","EXO PLANET","0","1","0","https://x.com/yurbbae_/status/1086417664577171456","3181119574","yurbbae_"
"1086523544194805760","Sat Jan 19 07:19:34 +0000 2019","0","Hai @TelkomCare tolong cek DM. Saya mengirimkan pesan perihal upgrade speed indihome yang tertunda cukup lama. Terima kasih.","1086523544194805760","","","in","Faraway","0","1","0","https://x.com/akbardani/status/1086523544194805760","82360689","akbardani"
"1086877395473305600","Sun Jan 20 06:45:38 +0000 2019","0","Ready akun @wifi.id :Rp.30.000 Tanpa durasi dan jaminan garansi 2 bulan Seamless@wifi.id : Rp.25.000 Tanpa durasi dan jaminan garansi 2 bulan INDIHOME : Rp.50.000 Tanpa durasi dan jaminan garansi 2 bulan... https://t.co/3sy6SxuEc5","1086877395473305600","","","in","","0","0","0","https://x.com/IlhamSimorangki/status/1086877395473305600","415515022","IlhamSimorangki"
"1086982247926747136","Sun Jan 20 13:42:17 +0000 2019","0","Indihome kapan mau buka blokir @NetflixID di Web yah males nongton di hape kaga punya tablet lagi.","1086982247926747136","","","in","Makasar - Jakarta","0","0","0","https://x.com/awaluddin/status/1086982247926747136","34553739","awaluddin"
"1086651063749332993","Sat Jan 19 15:46:17 +0000 2019","0","Demi apa bisa netflix annnn. Sorry norak soalnya ini IndiHome. Dah ga diblokir banget nihh?? Dan ini ga pake VPN https://t.co/s6Qq8zhxVR","1086651063749332993","https://pbs.twimg.com/media/DxSPYCdU0AAsr1O.jpg","","in","INDONESIA","0","3","0","https://x.com/mikuslodeon/status/1086651063749332993","194035354","mikuslodeon"
"1086861219506647041","Sun Jan 20 05:41:22 +0000 2019","1","Sekarang di https://t.co/JoHWQmFtVH bisa bayar indihome jg yuks bayar indihome sebelum jatuh tempo pada tanggal 20 di setiap bulannya #telkommempawah #indihomemempawah https://t.co/dydqlP7Wum","1086861219506647041","","","in","Kalimantan Barat, Indonesia","0","0","1","https://x.com/IndihomeMpw/status/1086861219506647041","1046379242299113473","IndihomeMpw"
"1086261941339774976","Fri Jan 18 14:00:03 +0000 2019","0","Indihome kenapa sihh mati nyala mulu huf","1086261941339774976","","","in","3/8/19❣️ • 🐥🦊🌱","0","1","0","https://x.com/jrbaragi/status/1086261941339774976","868843939385679872","jrbaragi"
"1086563856900444160","Sat Jan 19 09:59:45 +0000 2019","0","Ada yang pakai Indihome di sini?","1086563856900444160","","","in","Jakarta Capital Region","0","3","0","https://x.com/iyoskusuma/status/1086563856900444160","60024904","iyoskusuma"
"1086967406717591552","Sun Jan 20 12:43:19 +0000 2019","0","Hello @TelkomCare mau tanya: Mau pasang IndiHome di Kel. Rajeg Mulya. Apakah bisa ? Lebih tepatnya diperumahan baru: Pondok Permata Rajeg. Mohon infonya. Tks","1086967406717591552","","","in","Kab. Tangerang, Indonesia","0","2","0","https://x.com/anggestfirmanF/status/1086967406717591552","350808201","anggestfirmanF"
"1086246012749004800","Fri Jan 18 12:56:45 +0000 2019","0","Ini Dia Yang Ditunggu-tunggu: Netflix Udah Bisa dibuka Lewat Jaringan Indihome Tanpa VPN - https://t.co/eCraM5yAiL https://t.co/87TXf7YTga","1086246012749004800","","","in","Surabaya,ID","0","0","0","https://x.com/LunalsOfficial/status/1086246012749004800","549301688","LunalsOfficial"
"1086561573068464128","Sat Jan 19 09:50:41 +0000 2019","0","Indihome eror terus sih bikin kesel lagi banyak deadline &gt;_&lt;","1086561573068464128","","","in","DKI Jakarta, Indonesia","0","1","0","https://x.com/dianakrtn/status/1086561573068464128","743029363","dianakrtn"
"1087027301940744193","Sun Jan 20 16:41:19 +0000 2019","0","sudah 2 malam indihome saya lemot padahal main game aja itu pun main jam 11 malam sampai 3 subuh kenapa yah ? @IndihomeFiber @indihomekalsel","1087027301940744193","","","in","Banajarbaru","0","1","0","https://x.com/Tomykudukfhutaw/status/1087027301940744193","279040803","Tomykudukfhutaw"
"1086179034696830976","Fri Jan 18 08:30:36 +0000 2019","0","Dr kmren indihome @TelkomCare error mulu ditanya jawabannya sama percuma bayar mahal","1086179034696830976","","","in","kwangya","0","2","0","https://x.com/nurullyaini/status/1086179034696830976","233031843","nurullyaini"
"1087050601324670976","Sun Jan 20 18:13:54 +0000 2019","0","Amin ganteng aplikasi indihome dmna si @TelkomCare","1087050601324670976","","","in","","0","1","0","https://x.com/iskandar_dennys/status/1087050601324670976","1069570360046043136","iskandar_dennys"
"1085903032666152960","Thu Jan 17 14:13:52 +0000 2019","0"," Dulu pake telepon rumah harus nangkring terpaku sekarang dengan Movin bisa pake telepon rumah dari smartphone guys! Secanggih itu Indihome tuh! #10yearschallenge #movin #telpon #wifi #internet #indihome #streaming #smartphone #aplikasi #gadget #sukabumi #infosukabumi","1085903032666152960","","","in","Sukabumi, Indonesia","0","0","0","https://x.com/EdwinSan3/status/1085903032666152960","853790526","EdwinSan3"
"1086460930228015104","Sat Jan 19 03:10:45 +0000 2019","0","mohon ditindak lanjuti jaringan wifi indihome jalan nangka dps tidak ada koneksi @Telkom_INDIHome","1086460930228015104","","","in","Bali, Indonesia","0","1","0","https://x.com/gungrama18/status/1086460930228015104","1049670143251337219","gungrama18"
"1086858135598288896","Sun Jan 20 05:29:07 +0000 2019","0","Netflix uda nggak diblock indihome ","1086858135598288896","","","in","san junipero","0","1","0","https://x.com/rizamorah/status/1086858135598288896","1166112476","rizamorah"
"1086216411591000065","Fri Jan 18 10:59:08 +0000 2019","13","Zaman now makin digital makin efisien pakai CloudStorage 16GB FREE hanya dari IndiHome didukung Data Center TIER IV yuuk seluruh penjuru nusantara donlot di store. #JumatBerkah #BUMNHadirUntuknegeri https://t.co/4z30GtL1uP","1086216411591000065","https://pbs.twimg.com/media/DxMED_jUUAEG3si.jpg","","in","Indonesia","0","2","24","https://x.com/A_Sugiarto2015/status/1086216411591000065","52198601","A_Sugiarto2015"
"1086888568956477440","Sun Jan 20 07:30:02 +0000 2019","0","Selamat siang @TelkomCare..saya kecewa dgn program indihome paket BUMN..saya sdh berhasil create akun dgn email corporate namun selalu terkendala ketika registrasi.saya sdh hubungi call center 147 dan di infokan utk coba terus sampai berhasil..harus brp kali coba supaya berhasil?","1086888568956477440","","","in","","0","1","0","https://x.com/sr_arumsari/status/1086888568956477440","1027130401330880514","sr_arumsari"
"1086675409280720896","Sat Jan 19 17:23:01 +0000 2019","0","enci bgt bekasi knpsi terbelakang bet pgn pasang wifi tp pilihannya kl ga indihome/firstmedia/mnc HHH mahal smua","1086675409280720896","","","in","🍇","0","3","0","https://x.com/jirangdoongi/status/1086675409280720896","973130008452481025","jirangdoongi"
"1085822955916017664","Thu Jan 17 08:55:40 +0000 2019","0","Wahai @Telkomsel tolong segera perbarui kebijakan mengenai netflix. Jangan sampai telkom user dan indihome user pada belok kanan pindah haluan. ","1085822955916017664","","","in","","0","1","0","https://x.com/DylanT55/status/1085822955916017664","994458587580674053","DylanT55"
"1085889097674088448","Thu Jan 17 13:18:30 +0000 2019","0","indihome TV kabel gangguan yang di garut ??","1085889097674088448","","","in","Garut - Lebak Bulus - Ciputat","0","1","0","https://x.com/fadhlanridwan/status/1085889097674088448","93414786","fadhlanridwan"
"1085900016642736130","Thu Jan 17 14:01:53 +0000 2019","0","Mau nonton debat tp indihome nya gabisa nyala hmmm ","1085900016642736130","","","in","Somewhere","0","0","0","https://x.com/notetobeyou/status/1085900016642736130","68340109","notetobeyou"
"1086957656634355712","Sun Jan 20 12:04:34 +0000 2019","0","Admin @TelkomCare saat ini layanan indihome sy tidak aktif dan lampu LOS pada modem merah. Mohon solusiny","1086957656634355712","","","in","Bogor","0","1","0","https://x.com/hatfinadini/status/1086957656634355712","236686269","hatfinadini"
"1086920506660405248","Sun Jan 20 09:36:57 +0000 2019","0","Indihome udah bisa Netflix ya? Tapi tahun ini harus ngebut :)) Nggak akan ngejer nonton kayaknya. Alhambra aja baru 2 episode . Itu juga ditonton sambil nyetrika malam-malam. Sekarang waktu kepake buat kerja ngurusin rumah dan ngetwit kalau pas kangen kalian .","1086920506660405248","","","in","Sanur, Bali","0","2","0","https://x.com/__azza/status/1086920506660405248","43133378","__azza"
"1086918556724322306","Sun Jan 20 09:29:12 +0000 2019","0","Katanya neflix nggak diblokir indihome lagi kalo buka pake app tapi ini buktinya tetep nggak bisa....","1086918556724322306","","","in","Jakarta Capital Region, Indone","0","0","0","https://x.com/akugapapak/status/1086918556724322306","208320156","akugapapak"
"1085940021113155586","Thu Jan 17 16:40:51 +0000 2019","0","Selamat Pagi :) Semangat Kerjanya :) Dari aku yg gagal kamu pasangkan indihome di rumahku wkwkwkwkwk","1085940021113155586","","","in","-","0","0","0","https://x.com/_gchema/status/1085940021113155586","1189357843","_gchema"
"1086198265014509568","Fri Jan 18 09:47:01 +0000 2019","0","wah indihome bisa netflix","1086198265014509568","","","in","Balikpapan Barat, Indonesia","0","1","0","https://x.com/adhiprtm/status/1086198265014509568","75559486","adhiprtm"
"1086964122627919872","Sun Jan 20 12:30:16 +0000 2019","0","Indihome rumah gue kok lemot.....ada yg sama???","1086964122627919872","","","in","","1","2","0","https://x.com/hyuntlix/status/1086964122627919872","983085521097318400","hyuntlix"
"1086234477108518912","Fri Jan 18 12:10:55 +0000 2019","1","udah semangat mau nonton drakor.. eh sinyal indihome jele... streaming VIU ngadat.. download lama.. huft","1086234477108518912","","","in","","0","0","0","https://x.com/adnmrtsr/status/1086234477108518912","169487181","adnmrtsr"
"1086230525839208449","Fri Jan 18 11:55:13 +0000 2019","0","MAS INDIHOME KAPAN BENERIN KABELNYA ASTAGAAAA MATI KUTU W KAGA ADA WIFI DIRUMAH","1086230525839208449","","","in","surabaya","0","1","0","https://x.com/ketankmekdi/status/1086230525839208449","960120295930527744","ketankmekdi"
"1086206513692045312","Fri Jan 18 10:19:48 +0000 2019","0","Yang punya TV segede gaban trus punya akun Netflix tapi pake internet IndiHome mah harus banyak-banyak makan ati. So close yet so far~~~","1086206513692045312","","","in","221B Baker Street","0","2","0","https://x.com/iniAsna/status/1086206513692045312","80280651","iniAsna"
"1086272848350474240","Fri Jan 18 14:43:23 +0000 2019","0","ini wifi indihome ada gangguan kah? @TelkomCare","1086272848350474240","","","in","surabaya ,indonesia","0","1","0","https://x.com/Riendha_ika/status/1086272848350474240","962050286","Riendha_ika"
"1086589358239563777","Sat Jan 19 11:41:05 +0000 2019","0","Habbany cell melayani: Pembelian pulsa seluler kuota internet pulsa listrik bayar BPJS tagihan FIF INDIHOME Indovision dll","1086589358239563777","","","in","Bukit Kemuning, Indonesia","0","0","0","https://x.com/jurjani2/status/1086589358239563777","485311401","jurjani2"
"1085837527422922753","Thu Jan 17 09:53:35 +0000 2019","0","(02876601181) bagimana cara untuk mendapatkan e-billing indihome beberapa kali daftar via myindihome gagal terus keluar pesan Gagal! SOA [REG INDI ERROR: Error Fetching http headers] . tolong soluisnya ya @TelkomCare","1085837527422922753","","","in","Kebumen","0","1","0","https://x.com/pur_pongge/status/1085837527422922753","370467737","pur_pongge"
"1086867470252761089","Sun Jan 20 06:06:12 +0000 2019","0","NGAPAIN PAKE PAYTREN ? SAMA AJA SAMA YG LAIN !! . Eiiiit... Cek lagi bos. . Admin listrik di PayTren cuma 2000 di sebelah berapa ? . Beli pulsa kuota BPJS indihome PDAM tiket https://t.co/iYgkx5rjKI","1086867470252761089","","","in","Sidoarjo-Jawa Timur-Indonesia","0","0","0","https://x.com/nurainialyahya/status/1086867470252761089","1700673222","nurainialyahya"
"1086183521402716160","Fri Jan 18 08:48:26 +0000 2019","0","Pengalaman nonton film-film terbaik dari berbagai genre bisa Anda dapatkan dengan mudah di Minipack UseeTV. Aktifkan minipack IndiMovie 2 dan dapatkan konten-konten eksklusif dari HBO di https://t.co/VcfFhGzTJO","1086183521402716160","","","in","Jl Yos Sudarso No. 2, Magelang","0","0","0","https://x.com/telkommagelang/status/1086183521402716160","953454106114342912","telkommagelang"
"1086182048480591872","Fri Jan 18 08:42:35 +0000 2019","0","Liga voli nasional Proliga kembali digelar pada tahun 2019 ini. Proliga 2019 ini menjadi gelaran di tahun ke-18. Sebanyak 5 tim putri dan 6 tim putra akan bersaing menjadi yang terbaik. https://t.co/Hbb25TugoD","1086182048480591872","","","in","Jl Yos Sudarso No. 2, Magelang","0","0","0","https://x.com/telkommagelang/status/1086182048480591872","953454106114342912","telkommagelang"
"1085891649497006080","Thu Jan 17 13:28:38 +0000 2019","0","Gimana nih @indihome_bogor @IndiHome mau nonton debat capres &amp; cawapres malah gangguan","1085891649497006080","","","in","","0","0","0","https://x.com/bang_dhar01/status/1085891649497006080","828908752166277120","bang_dhar01"
"1086183013321453568","Fri Jan 18 08:46:25 +0000 2019","0","Aktifkan paket IndiKids dengan harga Rp60ribu/bulan di myIndiHome untuk berikan tayangan hiburan berkualitas untuk anak Anda. Download myIndiHome sekarang. #indihomemagelang @ Telkom https://t.co/5RA93Sv3bF","1086183013321453568","","","in","Jl Yos Sudarso No. 2, Magelang","0","0","0","https://x.com/telkommagelang/status/1086183013321453568","953454106114342912","telkommagelang"
"1085880977736515584","Thu Jan 17 12:46:14 +0000 2019","0","Si Jampang gebrak 7juta pelanggan IndiHome #livingthetelkomwayjaktim #telkomindonesia #latepost @ Telkom Indonesia Prumpung https://t.co/s5a21yPtQl","1085880977736515584","","","in","","0","0","0","https://x.com/sijampangjaktim/status/1085880977736515584","966966776616513536","sijampangjaktim"
"1086602131803537408","Sat Jan 19 12:31:50 +0000 2019","0","IndiHome maunya apa si","1086602131803537408","","","in","Bandung, Indonesia","0","0","0","https://x.com/helveetica/status/1086602131803537408","1663051123","helveetica"
"1086971608416350208","Sun Jan 20 13:00:01 +0000 2019","2","Sekarang mendengarkan musik terbaru dan terpopuler dalam satu genggaman. IndiHome Music menyajikan streaming musik online dengan katalog hingga 6 juta lagu dari musisi lokal maupun internasional. Download aplikasi IndiHome Music di Google Play atau App Store. https://t.co/Su3Z7MkytG","1086971608416350208","https://pbs.twimg.com/media/DwmL71PVYAAAVZV.jpg","","in","Indonesia","0","0","0","https://x.com/TelkomPromo/status/1086971608416350208","151794058","TelkomPromo"
"1086959708554948608","Sun Jan 20 12:12:43 +0000 2019","0","Gila gimana mau internetan kalau wifi mati mulu woy dilapor sehari besoknya bagus lusanya jelek lagi gmn sih ini indihome-_-","1086959708554948608","","","in","3/8/19❣️ • 🐥🦊🌱","0","1","0","https://x.com/jrbaragi/status/1086959708554948608","868843939385679872","jrbaragi"
"1086148852661415936","Fri Jan 18 06:30:40 +0000 2019","0","Telkom sepertinya hari ini mulai berdamai dengan Netflix: homepage-nya udah bisa diakses via aplikasi pakai IndiHome. Telkomsel belum nyangkut di loading mulu seperti biasa.","1086148852661415936","","","in","Indonesia","1","0","0","https://x.com/rayytama/status/1086148852661415936","126915526","rayytama"
"1086503597460852736","Sat Jan 19 06:00:18 +0000 2019","0","Dalam membangun Indonesia Digital Network (IDN) Telkom Indonesia berhasil melayani 162 juta pelanggan Telkomsel serta mempersembahkan layanan digital terdepan kepada 5 1 juta pelanggan https://t.co/5UAz7PSynA","1086503597460852736","","","in","South Borneo","0","0","0","https://x.com/indihomekalsel/status/1086503597460852736","277917561","indihomekalsel"
"1086560998776020992","Sat Jan 19 09:48:24 +0000 2019","0","London derby menentukan kebangkitan Arsenal saat menjamu Chelsea Sementara Brighton coba menahan laju MU dan Liverpool yang mewaspadai kejutan Crystal Palace . Berikut jadwal https://t.co/TFix9B3b0h","1086560998776020992","","","in","South Borneo","0","0","0","https://x.com/indihomekalsel/status/1086560998776020992","277917561","indihomekalsel"
"1086887073137782785","Sun Jan 20 07:24:06 +0000 2019","0","Irene dikirim Vatikan untuk menyelidiki kasus kematian misterius suster muda di Romania. Tak hanya beresiko kehilangan nyawa keyakinan dan jiwa mereka diuji ketika menghadapi suster https://t.co/2svYcsTrou","1086887073137782785","","","in","South Borneo","0","0","0","https://x.com/indihomekalsel/status/1086887073137782785","277917561","indihomekalsel"
"1086282831045611520","Fri Jan 18 15:23:03 +0000 2019","0","Fakk indihome udah bisa netflix kaya merasa bersalah gitu pindah ke lain hati menggunakan 1media","1086282831045611520","","","in","Tangerang-ID","0","0","0","https://x.com/billynrss/status/1086282831045611520","224485779","billynrss"
"1086439179414695936","Sat Jan 19 01:44:20 +0000 2019","1","derita pake tv cable indihome jadi tdk pernah nonton rcti mnc dan global ","1086439179414695936","","","in","UPG","0","2","0","https://x.com/ariesm0od/status/1086439179414695936","2158420958","ariesm0od"
