"conversation_id_str","created_at","favorite_count","full_text","id_str","image_url","in_reply_to_screen_name","lang","location","quote_count","reply_count","retweet_count","tweet_url","user_id_str","username"
"1160227030052589569","Sat Aug 10 16:30:54 +0000 2019","0","Berulang Kali Terkendala Pasang Baru #Indihome Karena ODP Penuh? - https://t.co/VbS4NealZX #CustomerService #InternetServiceProvider #OpticalDistributionPoint #PemasanganSambunganBaru #PemasanganSambunganInternet #TelkomIndonesia | cc @TelkomCare","1160227030052589569","","","in","Indonesia","1","1","0","https://x.com/MediaKonsumenID/status/1160227030052589569","1117529034","MediaKonsumenID"
"1160236213602639873","Sat Aug 10 17:07:24 +0000 2019","0","Liga inggris pindah ke tvri makin susah di indihome aja diacak pfft","1160236213602639873","","","in","","0","0","0","https://x.com/threeninetwo/status/1160236213602639873","234029511","threeninetwo"
"1160311535983460353","Sat Aug 10 22:16:29 +0000 2019","0","@SusiSabri Hai Sobat. Kami mohon maaf untuk sementara ini IndiHome tidak menayangkan EPL untuk season 2019/2020 dikarenakan channel beIN Sports yang sebelumnya menayangkan EPL untuk season 2016-2019 tidak memiliki hak siar EPL untuk season 2019-2020. Trims. -Nyil","1160313998803292160","","SusiSabri","in","","1","0","0","https://x.com/IndiHome/status/1160313998803292160","1075673058931806208","IndiHome"
"1160253677539479552","Sat Aug 10 18:25:19 +0000 2019","0","@singigih Sports masih menayangkan kompetisi bergengsi lainnya yang tidak kalah menarik seperti Serie A (Liga Italia) La Liga (Liga Spanyol) Ligue 1 (Liga Perancis) Major League Soccer (Liga Amerika Serikat) dan FA Cup. Dan tidak kalah menariknya IndiHome juga (2/3)","1160255823680921600","","singigih","in","","0","0","0","https://x.com/IndiHome/status/1160255823680921600","1075673058931806208","IndiHome"
"1160052649682583553","Sat Aug 10 04:57:59 +0000 2019","0","Dear @IndiHome dari kemarin internet saya tidak bisa lampu pada LOS kedap kedip merah sudah saya matikan tombol power off dan menunggu beberapa menit nyalakan lagi tetap masih sama. Saya coba hubungi call center namun sibuk. Mohon ditindak lanjuti. Terima kasih.","1160052649682583553","","","in","Jakarta Capital Region, Indonesia","0","1","0","https://x.com/mayabee/status/1160052649682583553","133599345","mayabee"
"1160230702744367104","Sat Aug 10 16:45:30 +0000 2019","1","Sinyal Indihome kalah jauh sama sinya tri https://t.co/TRPOTpKV65","1160230702744367104","https://pbs.twimg.com/media/EBn3qNcU4AIhNJU.jpg","","in","BANDUNG","0","1","0","https://x.com/herdiboy_/status/1160230702744367104","105991862","herdiboy_"
"1160113677317681153","Sat Aug 10 09:00:29 +0000 2019","0","Sobat IndiHome bisa upgrade paket Entry ke Essential untuk mendapatkan lebih dari 140 channel menarik melalui layar UseeTV atau aplikasi myIndiHome. Caranya pilih menu Minipack pada layar UseeTV -&gt; Pilih menu Essential. https://t.co/wJYi61S6BS #100persenfiber #indihomeborneo https://t.co/sO9PCLtNBi","1160113677317681153","https://pbs.twimg.com/media/EBmIWCBW4AYDyqV.jpg","","in","Samarinda, Kalimantan Timur","0","0","0","https://x.com/indizenborneo/status/1160113677317681153","818282124943863808","indizenborneo"
