"conversation_id_str","created_at","favorite_count","full_text","id_str","image_url","in_reply_to_screen_name","lang","location","quote_count","reply_count","retweet_count","tweet_url","user_id_str","username"
"1553678160327151616","Sun Jul 31 09:45:14 +0000 2022","0","Kerja di weekend mana suaranya? Yokk mangatss walopun weekend tetap harus mengerjakan yg blm tuntas. Ditemani koneksi indihome yg selalu membantu kerjaan hingga tungas https://t.co/Dbd8W2b5p5","1553678160327151616","https://pbs.twimg.com/ext_tw_video_thumb/1553678046397288448/pu/img/jqDxTYpNYcFFrmkq.jpg","","in","Kota Palu, Sulawesi Tengah","0","0","0","https://x.com/Qfly_Mu/status/1553678160327151616","1595032146","Qfly_Mu"
"1553768356112519169","Sun Jul 31 15:43:38 +0000 2022","0","Yup tv on demandnya indihome tv berguna sekali ketika ketinggalan acara live tv tinggal rewind cari acaranya wkwk btw demi si bestod ini ku rewind biar bisa nntn krn ketinggalan kemarin https://t.co/9ZG4xOT0MJ","1553768356112519169","https://pbs.twimg.com/ext_tw_video_thumb/1553768300588310529/pu/img/fUkRON_3943jqBcj.jpg","","in","Kota Palu, Sulawesi Tengah","0","0","0","https://x.com/Qfly_Mu/status/1553768356112519169","1595032146","Qfly_Mu"
"1553821754992123904","Sun Jul 31 19:15:49 +0000 2022","0","Tonton YouTube tiap hari gak takut kehabisan kuota tentunya berkat ada IndiHome dirumah saya pake IndiHome signal jdi lancar &amp; sngat hemat biaya. Wujudkan bersama indihome #AktivitasTanpaBatas #InternetnyaIndonesia https://t.co/5vMfGGvsgc","1553821754992123904","https://pbs.twimg.com/ext_tw_video_thumb/1553821743008993285/pu/img/XVsVoBK_bOIWkhCR.jpg","","in","Central Java, Indonesia","0","0","0","https://x.com/bywannn1/status/1553821754992123904","1397536765309640706","bywannn1"
"1553821809455144960","Sun Jul 31 19:16:02 +0000 2022","0","Main laptop tambah betah karna sdh ada jaringan IndiHome dirumah internetan jdi lancar &amp; tdk mengecewakan. yuk berlangganan indihome sekaranb juga tunggu apalagi!! #AktivitasTanpaBatas #InternetnyaIndonesia https://t.co/FzGIRvsOGA","1553821809455144960","https://pbs.twimg.com/ext_tw_video_thumb/1553821793701335040/pu/img/nTDo5tnNi7tYpfZa.jpg","","in","Central Java, Indonesia","0","0","0","https://x.com/bywannn1/status/1553821809455144960","1397536765309640706","bywannn1"
"1553821874752090112","Sun Jul 31 19:16:18 +0000 2022","0","Jualan online semakin lancar didukung signal internet yg semakin lancar siapa lg kalau bukan karna IndiHome jaringan Internetan yg tak mengecewakan &amp; selalu memuaskan.yuk Wujudkan bersama indihome. #AktivitasTanpaBatas #InternetnyaIndonesia https://t.co/kJ4sdKRZ45","1553821874752090112","https://pbs.twimg.com/ext_tw_video_thumb/1553821865033928704/pu/img/w_0ZEH5bkHirdA9V.jpg","","in","Central Java, Indonesia","0","0","0","https://x.com/bywannn1/status/1553821874752090112","1397536765309640706","bywannn1"
"1553833967299702785","Sun Jul 31 20:04:21 +0000 2022","0","Ini indihome knp dahh","1553833967299702785","","","in","yk","0","1","0","https://x.com/cumanbadutmu_/status/1553833967299702785","1445310784884469762","cumanbadutmu_"
"1553876528421048320","Sun Jul 31 22:53:28 +0000 2022","0","love you abangku itu yg di sensor adalah wifi Indihome https://t.co/LnllOmfiyy","1553876528421048320","https://pbs.twimg.com/media/FZB6d1daIAAVxbU.jpg","","in","","0","0","0","https://x.com/vaunyaa/status/1553876528421048320","1455477529691656192","vaunyaa"
"1553752671353376770","Sun Jul 31 14:41:18 +0000 2022","6","Anak indihome indomie mohon penerawangannya sosok putih jingklak di detik ke 5 Video diambil kemaren malem pas acara malam suro/muharram 1444h https://t.co/RZ1iZVid4j","1553752671353376770","https://pbs.twimg.com/ext_tw_video_thumb/1553752590730477569/pu/img/YpBHIc54sLWkGCeo.jpg","","in","Bandungan","0","1","0","https://x.com/xavier_rans/status/1553752671353376770","1322719126532448258","xavier_rans"
"1553781404999483393","Sun Jul 31 16:35:29 +0000 2022","0","Habis healing bareng temen2 enaknya tinggal rebahan sambil internetan pake IndiHome yg signalnya sngat memuaskan dijamin IndiHome gk mengecewakan.. #AktivitasTanpaBatas #InternetnyaIndonesia https://t.co/pkXdWmUVGB","1553781404999483393","https://pbs.twimg.com/ext_tw_video_thumb/1553781334929477633/pu/img/JMA4ZZrCSqHZ4y2P.jpg","","in","Semarang, Jawa Tengah","0","0","0","https://x.com/Kangcholis_/status/1553781404999483393","1506861369370431490","Kangcholis_"
"1553762514269532160","Sun Jul 31 15:20:25 +0000 2022","32","Digiland 2022 keren banget ada banyak keseruan yang bisa kalian nikmatin di sana Minti jadi pengen langsung terbangg ke Istora Senayan Ada yang udah datang kesana? Ceritain pengalaman kalian berada di Digiland dong #Alway57elkom #IndiHome https://t.co/W7LQmb9Duh","1553762514269532160","https://pbs.twimg.com/ext_tw_video_thumb/1553369921395929089/pu/img/6jr-bSeUbxTgJlHy.jpg","","in","Kota Makassar","1","4","40","https://x.com/indihomekti/status/1553762514269532160","1214820808079499269","indihomekti"
"1553753971357282306","Sun Jul 31 14:46:28 +0000 2022","1","Gabisa buka steam kak @IndiHome","1553753971357282306","","","tl","Langley, Virginia","0","0","0","https://x.com/404notsurrender/status/1553753971357282306","187080212","404notsurrender"
"1553773723593080832","Sun Jul 31 16:04:58 +0000 2022","0","Doooh wayah nganggur kelesotan biznet malah down jyaan ketularan indihome tenan iki","1553773723593080832","","","in","Sleman - Yogyakarta","0","0","0","https://x.com/Ipuulsaiful/status/1553773723593080832","274569524","Ipuulsaiful"
"1553886927773831168","Sun Jul 31 23:34:48 +0000 2022","0","Tapi ngga perlu khawatir karena ada IndiHome. Jaringan langsung lancar buat hubungan makin mesra. #IndiHome #InternetnyaIndonesia https://t.co/hNyfwm0WmA","1553886927773831168","https://pbs.twimg.com/ext_tw_video_thumb/1553886886237614080/pu/img/iJmUQti2qeAnFlQH.jpg","","in","Mystic Falls","0","0","0","https://x.com/mrindra_/status/1553886927773831168","615703714","mrindra_"
"1553782404531507200","Sun Jul 31 16:39:27 +0000 2022","0","Indihome mulai deh ngadat ","1553782404531507200","","","in","","0","1","0","https://x.com/ravenxxxxk/status/1553782404531507200","755847800","ravenxxxxk"
"1551859167190986754","Sun Jul 31 13:30:00 +0000 2022","19","Selamat para pemenang #TweetAway minggu ini Untuk yang belum menang cek syaratnya lag yak! Kalau lengkap pasti menang Giveaway minggu depan! Yang menang DM MinSum aja sekarang #TweetAway #IndiHome #Giveaway #GiveawayIndonesia #BerawalDariRumah #MySumateraGiveaway https://t.co/pTTNsbeAnY","1553734725587636225","https://pbs.twimg.com/media/FY_xRhBaMAIdBMb.jpg","MySumatera","in","Medan, Indonesia","0","6","11","https://x.com/MySumatera/status/1553734725587636225","1242389973086560256","MySumatera"
"1553880717477949440","Sun Jul 31 23:10:07 +0000 2022","1","Sharing aktivitas olah raga juga ngga khawatir kehabisan kuota kalo aksesnya pake IndiHome Badan fit n bugar aktivitas jg lancar selancar jaringan IndiHome. #SemuaMudahDenganIndiHome #InternetnyaIndonesia #SilaturahmiTanpaBatas https://t.co/OZxAlUkxFb","1553880717477949440","https://pbs.twimg.com/ext_tw_video_thumb/1553880674267832322/pu/img/W2Hdmm2n3ftFpbEs.jpg","","in","Medan Kota, Indonesia","0","0","0","https://x.com/mfnasution/status/1553880717477949440","1349150646","mfnasution"
"1553768184821723137","Sun Jul 31 15:42:57 +0000 2022","0","Selamat hari senin Sobat IndiHome. tetap semangat dan bahagia selalu bersama IndiHome ya! #AktivitasTanpaBatas #InternetnyaIndonesia https://t.co/rVQoMmfFEM","1553768184821723137","https://pbs.twimg.com/ext_tw_video_thumb/1553768159559426054/pu/img/fIUtklOdtbqHwq3C.jpg","","in","SEMARANG,Jawa Tengah","0","0","0","https://x.com/Awabridawan/status/1553768184821723137","885095925395460096","Awabridawan"
"1553883926527180806","Sun Jul 31 23:22:52 +0000 2022","1","Mengisi weekend dgn tontonan film pilihan di channel GALAXY IndiHome TV #SemuaMudahDenganIndiHome #InternetnyaIndonesia #SilaturahmiTanpaBatas https://t.co/KcSCPzHAIv","1553883926527180806","https://pbs.twimg.com/ext_tw_video_thumb/1553883896822919168/pu/img/YqbWtGgymqjudaga.jpg","","in","Medan Kota, Indonesia","0","0","0","https://x.com/mfnasution/status/1553883926527180806","1349150646","mfnasution"
"1553884250755432448","Sun Jul 31 23:24:09 +0000 2022","0","Apapun channelnya nontonnya tetap di Useetv IndiHome#IndiHome #InternetnyaIndonesia #AktivitasTanpaBatas https://t.co/8h3mosnx5j","1553884250755432448","https://pbs.twimg.com/ext_tw_video_thumb/1553884063366524928/pu/img/TUYpti9YVpChiQpL.jpg","","in","","0","0","0","https://x.com/dripdropminie/status/1553884250755432448","184232523","dripdropminie"
"1553745341337391110","Sun Jul 31 14:12:11 +0000 2022","0","Nonton Berita terkini dan terpercaya mudah banget tinggal berlangganan aja Usee TV go di stb indihome. Terimakasih indihome #IndiHome #IndiHomeCepat #IndiHomeJangkauanLuas https://t.co/PWyxoAeAAu","1553745341337391110","https://pbs.twimg.com/ext_tw_video_thumb/1553745329689792513/pu/img/K7iDGZCUYICH6qzV.jpg","","in","Kudus, Indonesia","0","0","0","https://x.com/solekhatun_isa/status/1553745341337391110","1534933661573091328","solekhatun_isa"
"1553878959905210368","Sun Jul 31 23:03:08 +0000 2022","0","Main laptop tambah betah karna sdh ada jaringan IndiHome dirumah internetan jdi lancar &amp; tdk mengecewakan. yuk berlangganan indihome sekaranb juga tunggu apalagi!! #AktivitasTanpaBatas #InternetnyaIndonesia https://t.co/I7rqToiDPd","1553878959905210368","https://pbs.twimg.com/ext_tw_video_thumb/1553878942377197568/pu/img/M6WS7ylCIJr3eqq_.jpg","","in","","0","0","0","https://x.com/suparya95185925/status/1553878959905210368","1528755738411438080","suparya95185925"
"1553878658640920576","Sun Jul 31 23:01:56 +0000 2022","0","Jualan online semakin lancar didukung signal internet yg semakin lancar siapa lg kalau bukan karna IndiHome jaringan Internetan yg tak mengecewakan &amp; selalu memuaskan.yuk Wujudkan bersama indihome. #AktivitasTanpaBatas #InternetnyaIndonesia https://t.co/MdLARHs3ea","1553878658640920576","https://pbs.twimg.com/ext_tw_video_thumb/1553878647500832768/pu/img/Flcc2I4RFleCjdIe.jpg","","in","","0","0","0","https://x.com/suparya95185925/status/1553878658640920576","1528755738411438080","suparya95185925"
"1553768448295325696","Sun Jul 31 15:44:00 +0000 2022","0","indihome gajelas ew jelek banget","1553768448295325696","","","in","","0","0","0","https://x.com/clumsylalaa/status/1553768448295325696","1537419236477648896","clumsylalaa"
"1553765834367021056","Sun Jul 31 15:33:37 +0000 2022","2","dengan IndiHome semuanya lanvar #IndiHome #AKtifKreatif #DigitalBisa #PastiBeres #InternetnyaIndonesia #AktivitasTanpaBatas #SemuaMudahDenganIndiHome #UntukIndonesiaLebihBaik https://t.co/Wp4RVxAuYd","1553765834367021056","https://pbs.twimg.com/ext_tw_video_thumb/1553765766570250240/pu/img/mHJ3XAOp1idIZABN.jpg","","in","Kota Sibolga, Indonesia","0","0","0","https://x.com/Marasi56868661/status/1553765834367021056","1388632436842516481","Marasi56868661"
"1553766557423087617","Sun Jul 31 15:36:29 +0000 2022","1","Saat nya login.. pastikan internetnya stabill dengan IndiHome semuanya lancar #IndiHome #AKtifKreatif #DigitalBisa #PastiBeres #InternetnyaIndonesia #AktivitasTanpaBatas #SemuaMudahDenganIndiHome #UntukIndonesiaLebihBaik https://t.co/eZX21SlmoF","1553766557423087617","https://pbs.twimg.com/ext_tw_video_thumb/1553766478876254208/pu/img/ukxiDpan1JVaSmGT.jpg","","in","Kota Sibolga, Indonesia","0","0","0","https://x.com/Marasi56868661/status/1553766557423087617","1388632436842516481","Marasi56868661"
"1553748522624638977","Sun Jul 31 14:24:49 +0000 2022","0","Nonton konten mukbang di youtube pakai indihome nih duh selera bgt ya bestie liatnya hihihii #IndiHome #AktivitasTanpaBatas #InternetnyaIndonesia https://t.co/DKHAUods4s","1553748522624638977","https://pbs.twimg.com/ext_tw_video_thumb/1553748483949019137/pu/img/pxGTAUdzKJUBd1jh.jpg","","in","Semarang, Jawa Tengah","0","0","0","https://x.com/Gammti/status/1553748522624638977","1543633446534139904","Gammti"
"1553745882243145729","Sun Jul 31 14:14:20 +0000 2022","0","Main mobile legend udah gak lag lag lagi main ling auto fast hand dengan jaringan indihome ping stabil banget #InternetnyaIndonesia #IndiHome #AktivitasTanpaBatas https://t.co/lXwNes1gGg","1553745882243145729","https://pbs.twimg.com/ext_tw_video_thumb/1553745850651721728/pu/img/DZBFQkAa0Yhm1QUS.jpg","","in","Kudus, Indonesia","0","1","0","https://x.com/impronfary/status/1553745882243145729","1538152353106276352","impronfary"
"1553721123501907968","Sun Jul 31 12:35:57 +0000 2022","0","live shopping dulu internetnya lancar pakai IndiHome #aktivitastanpabatas #internetnyaindonesia #indihome https://t.co/b16BMBxDA2","1553721123501907968","https://pbs.twimg.com/ext_tw_video_thumb/1553721043545919488/pu/img/SZN1FbmHoTXu3qDG.jpg","","in","Kota Medan, Sumatera Utara","0","0","0","https://x.com/NoniEfrisa/status/1553721123501907968","1553184796427571201","NoniEfrisa"
"1553768902592991233","Sun Jul 31 15:45:48 +0000 2022","0","Indihome apabgt sih","1553768902592991233","","","in","","0","2","0","https://x.com/yshraaah/status/1553768902592991233","383202783","yshraaah"
"1553671153788432386","Sun Jul 31 09:17:23 +0000 2022","0","[INFO GAMAS] Minggu 31 Juli 2022 Gangguan massal IndiHome area Raya Ketapanrame Trawas Dusun Sukorame Komplek Vila Puncak Trawas dan sekitarnya. Masih dilakukan pengecekan oleh tim terkait. #indihome #telkom #pandaan #prigen #trawas #mojokerto https://t.co/aDAa9g3Ty3","1553671153788432386","https://pbs.twimg.com/media/FY-_rjpVsAA00d8.jpg","","in","Sidoarjo, Indonesia","0","1","0","https://x.com/indihomesda/status/1553671153788432386","1384405038999556096","indihomesda"
"1553771357074104320","Sun Jul 31 15:55:33 +0000 2022","0","Indihome kwontol i","1553771357074104320","","","in","","0","1","0","https://x.com/wima___/status/1553771357074104320","875423252","wima___"
"1553740575488507906","Sun Jul 31 13:53:14 +0000 2022","0","Susah juga jadi anak indihome","1553740575488507906","","","in","RLA","0","0","0","https://x.com/jenana_00/status/1553740575488507906","840193676986933249","jenana_00"
"1553883002656391168","Sun Jul 31 23:19:12 +0000 2022","1","Selamat Ulang Tahun Telkom Yang Ke 57 Tahun @IndiHome #Alway57elkom #DigilandWithIndiHome ayo guys ikutan jugaa @fatikarisma15 @IFatkhu @Harma1806","1553883002656391168","","","in","Simping Sidomoyo Godean YK","0","0","0","https://x.com/Zhie2808/status/1553883002656391168","1407118189","Zhie2808"
"1553827984293130241","Sun Jul 31 19:40:34 +0000 2022","0","Bisa tukar poin loh #AktivitasTanpaBatas #BerjuangTanpaBatas #IndiHome #IndiHomeSelaludiHati #InternetnyaIndonesia https://t.co/H0H6lQ8G4F","1553827984293130241","https://pbs.twimg.com/ext_tw_video_thumb/1553827954199003136/pu/img/Blyta90kv2sC26Gp.jpg","","in","Medan Timur, Indonesia","0","0","0","https://x.com/repull/status/1553827984293130241","220263902","repull"
"1553827562488745984","Sun Jul 31 19:38:54 +0000 2022","0","Sobat ada gak? #AktivitasTanpaBatas #BerjuangTanpaBatas #IndiHome #IndiHomeSelaludiHati #InternetnyaIndonesia https://t.co/QfAlHVRhF2","1553827562488745984","https://pbs.twimg.com/ext_tw_video_thumb/1553827532277186560/pu/img/f5SLXTbu2why2AHF.jpg","","in","Medan Timur, Indonesia","0","0","0","https://x.com/repull/status/1553827562488745984","220263902","repull"
"1553882632567791616","Sun Jul 31 23:17:44 +0000 2022","1","Selamat Ulang Tahun Telkom Yang Ke 57 Tahun @IndiHome makin maju di bumi Pertiwi dan Semakin Berkembang lagi #Alway57elkom #DigilandWithIndiHome ayo guys ikutan jugaa @fatikarisma15 @IFatkhu @Harma1806","1553882632567791616","","","in","Simping Sidomoyo Godean YK","0","0","0","https://x.com/Zhie2808/status/1553882632567791616","1407118189","Zhie2808"
"1553788685027790848","Sun Jul 31 17:04:25 +0000 2022","0","indihome knp lg ey?? ini beyond live lg killing part nya kick it","1553788685027790848","","","in","","0","1","0","https://x.com/paket_nasipanas/status/1553788685027790848","922278179787571201","paket_nasipanas"
"1553871096918966273","Sun Jul 31 22:31:53 +0000 2022","0","mau mandi ribet ngurusin indihome","1553871096918966273","","","in","","0","0","0","https://x.com/vaunyaa/status/1553871096918966273","1455477529691656192","vaunyaa"
"1553756119922667526","Sun Jul 31 14:55:01 +0000 2022","0","indihome kurang ajar lagi nonton cipung abubu malah lemot.","1553756119922667526","","","in","","0","1","0","https://x.com/cicnema/status/1553756119922667526","1457912612369231876","cicnema"
"1553868145060118528","Sun Jul 31 22:20:09 +0000 2022","0","akhirnya... indihome bangsat","1553868145060118528","","","in","","0","0","0","https://x.com/vaunyaa/status/1553868145060118528","1455477529691656192","vaunyaa"
"1553886624064319489","Sun Jul 31 23:33:35 +0000 2022","0","Tapi ngga perlu khawatir karena ada IndiHome. Jaringan langsung lancar buat hubungan makin mesra. #IndiHome #InternetnyaIndonesia https://t.co/xkqRoOUHav","1553886624064319489","https://pbs.twimg.com/ext_tw_video_thumb/1553886585023713280/pu/img/8yRNZL5oCg9AeSG7.jpg","","in","","0","0","0","https://x.com/FindaJuliaCitra/status/1553886624064319489","1547468006892089344","FindaJuliaCitra"
"1553815315145826305","Sun Jul 31 18:50:14 +0000 2022","0","Nonton film box office seru di channel galaxy premium dari indihome tv kualitas gambar bagus dan filmnya yg ditayangkan film populer semua ada di indihome #AktivitasTanpaBatas #InternetnyaIndonesia https://t.co/bm6Pc42t3R","1553815315145826305","https://pbs.twimg.com/ext_tw_video_thumb/1553815279003611137/pu/img/nGxWQBHumAVYayYu.jpg","","in","","0","0","0","https://x.com/Ilhamdo85/status/1553815315145826305","1529109750742257664","Ilhamdo85"
"1553822262238666752","Sun Jul 31 19:17:50 +0000 2022","0","Main laptop tambah betah karna sdh ada jaringan IndiHome dirumah internetan jdi lancar &amp; tdk mengecewakan. yuk berlangganan indihome sekaranb juga tunggu apalagi!! #AktivitasTanpaBatas #InternetnyaIndonesia https://t.co/9ZSFpmXHvA","1553822262238666752","https://pbs.twimg.com/ext_tw_video_thumb/1553822245855694848/pu/img/Lcmrezii1KkMNDHo.jpg","","in","","0","0","0","https://x.com/Ilhamdo85/status/1553822262238666752","1529109750742257664","Ilhamdo85"
"1553848942240346112","Sun Jul 31 21:03:51 +0000 2022","0","Perasaan Minggu ke Senin cepet banget ya. Padahal Senin ke Minggu lama banget. Kerja lagi meeting online lagi bikin rencana kerjaan lagi. Tapi IndiHome ngga ada lelahnya tu bantu pekerjaanku hihi makasih IndiHome ️️ #InternetnyaIndonesia #AktivitasTanpaBatas https://t.co/XrtxMlrh6u","1553848942240346112","https://pbs.twimg.com/ext_tw_video_thumb/1553848906693644288/pu/img/mWHdZ_0qxT_6AeHe.jpg","","in","","0","0","0","https://x.com/RatnaJu11372783/status/1553848942240346112","1493092014157889539","RatnaJu11372783"
"1553822413418160128","Sun Jul 31 19:18:26 +0000 2022","0","Jualan online semakin lancar didukung signal internet yg semakin lancar siapa lg kalau bukan karna IndiHome jaringan Internetan yg tak mengecewakan &amp; selalu memuaskan.yuk Wujudkan bersama indihome. #AktivitasTanpaBatas #InternetnyaIndonesia https://t.co/BbxHEHyoF3","1553822413418160128","https://pbs.twimg.com/ext_tw_video_thumb/1553822397362409472/pu/img/COJCl6ONKqKf3STn.jpg","","in","","0","0","0","https://x.com/Ilhamdo85/status/1553822413418160128","1529109750742257664","Ilhamdo85"
"1553815444749819904","Sun Jul 31 18:50:45 +0000 2022","0","Menemani anak smbil menonton film kesukaannya tuk tidur lbh nyaman pakai indihome memang pilihan yg sesuai dengan jaringan tercepat bebas hambatan membuat lebih stabil ketika menonton film #IndiHome #AktivitasTanpaBatas #InternetnyaIndonesia https://t.co/ioTIP84KHX","1553815444749819904","https://pbs.twimg.com/ext_tw_video_thumb/1553815434066923520/pu/img/ss6V7wSCixbTwWBp.jpg","","in","","0","0","0","https://x.com/Ilhamdo85/status/1553815444749819904","1529109750742257664","Ilhamdo85"
"1553770626091196416","Sun Jul 31 15:52:39 +0000 2022","0","Memang paling pas Indihome memang sangat membantu semua kegiatan online saat pandemi belum berakhir #IndiHome #internetnyalndonesia #AktivitasTanpaBatas https://t.co/cD6mNnSgyW","1553770626091196416","https://pbs.twimg.com/ext_tw_video_thumb/1553770579995803648/pu/img/jDVv7UCAvZwrNnNn.jpg","","in","Pare, Indonesia","0","0","0","https://x.com/tamharanidab/status/1553770626091196416","1511777311976136704","tamharanidab"
"1553643844465750016","Sun Jul 31 07:28:52 +0000 2022","1","Ada yang baru lagi nih. Sekarang ini sinyal internet bisa diperkuat di seluruh penjuru rumah lho Pake WiFi Extender dari IndiHome seluruh sudut rumah jadi bisa terjangkau. Asyiknya lagi tanpa kabel tambahan dan mudah dipindah-pindah sesuai kebutuhan https://t.co/hB7hcLZdQ5","1553643844465750016","https://pbs.twimg.com/media/FY-m11baUAAtTbD.jpg","","in","Yogyakarta, Indonesia","0","0","0","https://x.com/kinosukina/status/1553643844465750016","2602416942","kinosukina"
"1553663985991397376","Sun Jul 31 08:48:54 +0000 2022","0","Wah weekend brg indihome makin seru santai dirumah sambil nonton indihome tv aja banyak pilihan film menarik karena sekarang indihome tv tersedia beberapa pilihan channel yang menarik jadi tidak usah takut ngelag lagi nih Sob!! Ayo berlangganan indihome #InternetnyaIndonesia https://t.co/PB15oXeIfq","1553663985991397376","https://pbs.twimg.com/tweet_video_thumb/FY-5J6_VEAAtdj8.jpg","","in","Jakarta Selatan, DKI Jakarta","0","0","0","https://x.com/larasn1n/status/1553663985991397376","2353409167","larasn1n"
"1553737211257843712","Sun Jul 31 13:39:52 +0000 2022","0","Taiiiiii @indihome tiap malem ky apaan aja gw","1553737211257843712","","","in","","0","0","0","https://x.com/montresour/status/1553737211257843712","972351086307688449","montresour"
"1553730350605406208","Sun Jul 31 13:12:37 +0000 2022","0","Hallo @TENESA_TELKOM @IndiHome jaringan wifi saya dari kemarin trouble loh. Udah dm juga tapi sampe malam ini belum ada tanggapan apapun. Gimana yaaa? Boleh dong dibantu biar sama2 enak. Jangan giliran ada keluhan malah menghilang","1553730350605406208","","","in","","0","1","0","https://x.com/nyamukarimun/status/1553730350605406208","260045638","nyamukarimun"
"1553777293440720896","Sun Jul 31 16:19:09 +0000 2022","0","Buah tomat dikirim jauh ke kota Medan Sampai di Medan tak lupa beli buah markisa Selamat HUT ke 57 saya ucapkan Semoga @IndiHome jadi operator pilihan kita semua #Alway57elkom #DigilandWithIndiHome Done @veroniicaa_06 Kuylah @tsara_na21 tsara @haidi_bysr @Nita_ucil","1553777293440720896","","","in","","0","0","0","https://x.com/PembebasanTinta/status/1553777293440720896","1210029611028844544","PembebasanTinta"
"1553886317095727106","Sun Jul 31 23:32:22 +0000 2022","0","HUT Telkom @IndiHome ke 57 Semoga makin jaya dan terdepan #Alway57elkom #DigilandWithIndiHome Yuk ikutan guys @rika_widayah @ndesinovalia @Anjani_putri2 Dan follow @GadisHijrahID","1553886317095727106","","","in","South Sumatra, Indonesia","1","0","0","https://x.com/dantimarezasari/status/1553886317095727106","769571274","dantimarezasari"
"1553742848377638913","Sun Jul 31 14:02:16 +0000 2022","1","w udah 3 hari marahin indihome kek pas valo doang beneran pingnya jumping main game lain ngga","1553742848377638913","","","in","","0","2","0","https://x.com/useresper/status/1553742848377638913","879552579562201089","useresper"
"1553797998240759808","Sun Jul 31 17:41:25 +0000 2022","0","kenapasih indihome gembel bgt w harus segera ganti wifi","1553797998240759808","","","in","","0","1","0","https://x.com/seokjinisme/status/1553797998240759808","1507043027503570973","seokjinisme"
"1553811524241596416","Sun Jul 31 18:35:10 +0000 2022","1","Akhirnya bisa lihat lagi konser @JamrudBand sudah cukup lama tidak bersemangat seperti ini sambil nyanyi lagunya yg melekat penikmat musik rock Birthday @TelkomIndonesia 75th @DigilandID @IndiHome #jamrud #konser #birthday #telkomindonesia #75th #digilandid #indihome https://t.co/4ckMNhaYOL","1553811524241596416","https://pbs.twimg.com/ext_tw_video_thumb/1553811428124925952/pu/img/s1aPZ6xaHMCsMHen.jpg","","in","","0","0","0","https://x.com/Ryuzaky46/status/1553811524241596416","440710947","Ryuzaky46"
"1553870238042968064","Sun Jul 31 22:28:28 +0000 2022","0","Hallo ka wifi dirumah orangtua saya gangguan mulai tadi malam sampe sekarang @IndiHome @IndiHomeCare","1553870238042968064","","","in","Banjarbaru,Kalimantan Selatan","0","1","0","https://x.com/pndanarum/status/1553870238042968064","493672883","pndanarum"
"1553790559000485889","Sun Jul 31 17:11:51 +0000 2022","0","Internet gue matikkk @IndiHome","1553790559000485889","","","in","","0","3","0","https://x.com/acinkg_/status/1553790559000485889","126879649","acinkg_"
"1553731156415107072","Sun Jul 31 13:15:49 +0000 2022","2","kemon bestie ikutan yuk GIVEAWAY - GA @Kopi_ajah @theT4ntryS1 @putri_Aalona Buat meriahin HUT TELKOM @indihome #Alway57elkom #DigilandWithIndiHome","1553731156415107072","","","in","West Java, Indonesia","0","1","0","https://x.com/abbynfam/status/1553731156415107072","1350779748591431682","abbynfam"
"1553731325915324422","Sun Jul 31 13:16:29 +0000 2022","1","Jaringan indihome ngilang mulu perasaan","1553731325915324422","","","in","Semarang, Jawa Tengah","0","0","0","https://x.com/kawepebee/status/1553731325915324422","264070909","kawepebee"
