"conversation_id_str","created_at","favorite_count","full_text","id_str","image_url","in_reply_to_screen_name","lang","location","quote_count","reply_count","retweet_count","tweet_url","user_id_str","username"
"1678376040035676165","Mon Jul 10 12:10:05 +0000 2023","0","Daftar DNS IndiHome Tercepat Bikin Internet Ngebut! https://t.co/CQqcYGIokh","1678376040035676165","","","in","","0","0","0","https://x.com/IDNTimes/status/1678376040035676165","388190238","IDNTimes"
"1678268407475736576","Mon Jul 10 05:02:23 +0000 2023","0","Tumben indihome inisiatif ngechat duluan soal internet loss ","1678268407475736576","","","in","else-where","0","1","0","https://x.com/e_e_e_c_a_a_a/status/1678268407475736576","40565095","e_e_e_c_a_a_a"
"1678320947445792768","Mon Jul 10 08:31:10 +0000 2023","0","INDIHOME LEMOT BANGET SIH KAMPRWT","1678320947445792768","","","in","rumah yuta","0","1","0","https://x.com/yyuta232/status/1678320947445792768","1148202913161814016","yyuta232"
"1677570523822440449","Sat Jul 08 06:49:15 +0000 2023","0","Apa lagi gangguan min @IndiHomeCare @IndiHome","1677570523822440449","","","in","Jakarta Capital Region","0","1","0","https://x.com/ipramono_/status/1677570523822440449","118054686","ipramono_"
"1678332889078075392","Mon Jul 10 09:18:37 +0000 2023","0","ini modelan apelagi dah ada orang ke rumah ngaku dari @IndiHome katanya tuker modem kebetulan yang nerima ibu mertua jadi gatau apa-apa. eh modemnya gabalik lagi monyettttttt........ maling modem berkedok indihome.","1678332889078075392","","","in","Jakarta - Bandung , ID","0","3","0","https://x.com/__binar/status/1678332889078075392","254829008","__binar"
"1678270835940020226","Mon Jul 10 05:12:02 +0000 2023","2","Sebuah cerita legenda tentang Rama dan Sita menjalani kehidupan dengan berbagai tantangannya.Apakah di cinta dapat menang diatas kejahatan? #AktivitasTanpaBatas #TinggalPilihNontonBareng https://t.co/KaVxMiEvJ2","1678270835940020226","https://pbs.twimg.com/media/F0pqbOGaIAYo6bg.jpg","","in","Indonesia","0","1","1","https://x.com/indihometvcom/status/1678270835940020226","528328843","indihometvcom"
"1678403782227419142","Mon Jul 10 14:00:19 +0000 2023","0","indihome emang boleh sengentot ini","1678403782227419142","","","in","","0","0","1","https://x.com/kittheist/status/1678403782227419142","1056046391737245696","kittheist"
"1677550770663878657","Sat Jul 08 05:30:45 +0000 2023","0","#zonauang #zonaba ready data tagihan indihome yang mau gestun akulaku bsa ya fee 28% nominal around 300an gituuu","1677550770663878657","","","in","she/her.18","0","0","0","https://x.com/cherrycoid/status/1677550770663878657","1263793772732825600","cherrycoid"
"1677894335738822661","Sun Jul 09 04:15:58 +0000 2023","0","Indihome ampas tenan","1677894335738822661","","","in","Yogyakarta, Indonesia","0","1","0","https://x.com/rzansrl_/status/1677894335738822661","272727034","rzansrl_"
"1678240134905614337","Mon Jul 10 03:10:03 +0000 2023","2","Walau memiliki pandangan yang berbeda Kabir &amp; Zara memperjuangkan cinta mereka. Rukhsaar yang memiliki perasaan untuk Kabir masih menyimpan dendam untuk menghancurkan Zara! Bagaimana mereka akan bertahan? #AktivitasTanpaBatas #TinggalPilihNontonBareng #ZeeBioskop https://t.co/QJluMs3Roc","1678240134905614337","https://pbs.twimg.com/media/F0pOgKoakAAUIHE.jpg","","in","Indonesia","0","1","1","https://x.com/indihometvcom/status/1678240134905614337","528328843","indihometvcom"
"1678364369833582593","Mon Jul 10 11:23:42 +0000 2023","0","Indihome tai!","1678364369833582593","","","in","pa. lo","0","1","0","https://x.com/zeamayszu/status/1678364369833582593","2160744559","zeamayszu"
"1677909054641807360","Sun Jul 09 05:14:27 +0000 2023","0","Indihome lemot banget asli jaringan nya merahh @IndiHomeCare tolong dong minn","1677909054641807360","","","in","moa.only!!","0","2","0","https://x.com/BeomBomie/status/1677909054641807360","1476919438645493767","BeomBomie"
"1678346991674482694","Mon Jul 10 10:14:39 +0000 2023","1","yang paling pertama kutuntut di akhirat adalah jaringan telkomsel dan indihome","1678346991674482694","","","in","pale blue dot","0","1","1","https://x.com/heydianprasetya/status/1678346991674482694","244073366","heydianprasetya"
"1678260942130520064","Mon Jul 10 04:32:43 +0000 2023","0","indihome lo ada masalah ape sih","1678260942130520064","","","in","Indonesia","0","1","0","https://x.com/bebefugu/status/1678260942130520064","1429583618","bebefugu"
"1678210319838072833","Mon Jul 10 01:11:34 +0000 2023","1","Tambah khazanah pefilman di Pop Corn bersama @gandhifernandoo dan @gigigitch_Story yang kali ini akan membahas Film Hits Pencuri Perhatian Tonton di Usee Prime pada layanan IndiHome TV. Nikmati akses streaming melalui aplikasi IndiHome TV atau https://t.co/hXhlJ6BNIs https://t.co/LMDh5XnEvm","1678210319838072833","https://pbs.twimg.com/ext_tw_video_thumb/1678210263705878528/pu/img/A4ukXjrnjm_qQm14.jpg","","in","Indonesia","0","0","0","https://x.com/useeprime/status/1678210319838072833","1479299307102609411","useeprime"
"1677573976359587840","Sat Jul 08 07:02:58 +0000 2023","0","indihome ribet banget udh pindah rumah dri seminggu lalu tpi wifii masih dirumah lamaaa prosesnya udh hampir 1mingguuu perubahannya dikit bgt responnya lamaa bangettt dijwbb bisa 2 3 jamm ","1677573976359587840","","","in","nct • treasure • zb1 •enhypen ","0","1","0","https://x.com/jayluvv111/status/1677573976359587840","1313376281975635969","jayluvv111"
"1678443500314976256","Mon Jul 10 16:44:17 +0000 2023","0","@zchchenlee Waduh.. tenang kak. Sini aku bantu yuk kirim nomor indihome alamat lengkap sama nomor Telkomsel nya via DM biar bisa dibantu kendala IndiHome dan Telkomsel nya :) -Eri","1678445047501529104","","calemyname","in","Indonesia","0","0","0","https://x.com/Telkomsel/status/1678445047501529104","255409050","Telkomsel"
"1678221013258215424","Mon Jul 10 01:54:04 +0000 2023","0","Tanggal begini tagihan dah berjejer panjang Tagihan Listrik rumah sragen BPJS Indihome Token listrik rumah maluku dll menanti","1678221013258215424","","","in","Surakarta","0","1","1","https://x.com/Ketika_setyo/status/1678221013258215424","344363555","Ketika_setyo"
"1678348285785047040","Mon Jul 10 10:24:09 +0000 2023","0","@irma_irris Paket Halo IndiHome adalah penawaran paket bulanan Halo yang diberikan bersamaan dengan pembelian paket IndiHome penawaran ini berlaku bagi pelanggan baru Telkomsel Halo ya Kak. Info lengkap paket Halo IndiHome bisa cek di https://t.co/GFPfhR3lEL . Tks :) -Kiano","1678349382826217472","","irma_irris","in","Indonesia","0","0","0","https://x.com/Telkomsel/status/1678349382826217472","255409050","Telkomsel"
"1677626045997150208","Sat Jul 08 10:29:52 +0000 2023","0","Aplikasimu kyk sampah my Indihome kirim kode nunggu 5 menit @IndiHome","1677626045997150208","","","in","Probolinggo, Jawa Timur","0","0","0","https://x.com/Romadhoni570/status/1677626045997150208","716045444","Romadhoni570"
"1678238646477139969","Mon Jul 10 03:04:08 +0000 2023","0","Tolong restart nms atau reset by system @IndiHome @IndiHomeCare Nomor indihomenya ada di dm Tolong yah. Gal guna soalnya. Up doang no traffic","1678238646477139969","","","in","","0","1","0","https://x.com/beyewe16/status/1678238646477139969","97179207","beyewe16"
"1677723487807623169","Sat Jul 08 16:57:04 +0000 2023","0","Paling sering dapat respons atau reply DM seperti ini Mimin masih butuh waktu nih Kak buat ngecek. Mohon ditunggu ya. Dari admin @Telkomsel @IndiHome Berulang-ulang","1677723487807623169","","","in","Bekasi Selatan, Indonesia","0","0","0","https://x.com/dhea_ardi/status/1677723487807623169","446561230","dhea_ardi"
"1678462242537508864","Mon Jul 10 17:52:37 +0000 2023","1","Pak @erickthohir tolong chek instansi Telkom/indihome @IndiHome @IndiHomeCare kita bayar sesuai tgl tdk telat tp kinerja parah sekali telat 1 hari blokir tp internet tdk bs di pakai malah menyusahkan","1678462242537508864","","","in","AT home","0","2","0","https://x.com/vincentDemons/status/1678462242537508864","160810102","vincentDemons"
"1677718101515993088","Sat Jul 08 16:35:40 +0000 2023","0","Gak usah bales DM semua data sudah saya kirim Cepat buat Surat laporan aja dan kirim Teknisi segera Gak usah pakai basa-basi Saya hanya minta segera lakukan perbaikan secepatnya Ngerti yaa Pak Admin @Telkomsel @IndiHome","1677718101515993088","","","in","Bekasi Selatan, Indonesia","0","1","0","https://x.com/dhea_ardi/status/1677718101515993088","446561230","dhea_ardi"
"1678300055659479041","Mon Jul 10 07:08:09 +0000 2023","1","Kepemilikan Efektif Telkom di Telkomsel Naik Usai Serahkan IndiHome #selularid #news #telkom #telkomsel #singtel https://t.co/J085TIN464 lewat @motoupdate","1678300055659479041","","","in","","0","0","0","https://x.com/SelularID/status/1678300055659479041","57223495","SelularID"
